{
  "schemaVersion":"1.0.0",
  "project":{"repository":"https://github.com/billy-una/CRMHOTEL.git","ref":"b7b0f8e83871df1220865931f53424d8dd39772c","expectedRemote":"https://github.com/billy-una/CRMHOTEL.git","expectedCommit":"b7b0f8e83871df1220865931f53424d8dd39772c"},
  "scope":"comparación de transferencia Engineering desde objetos Git",
  "contracts":[
    {"id":"ENG-001","name":"Estado operativo explícito","owner":"producto","evidence":[{"path":"documentacion/ARCHITECTURE/offline-and-recovery.md","containsAll":["estado offline"]}]},
    {"id":"ENG-002","name":"Autoridad transaccional","owner":"aplicación","evidence":[{"path":"config/transaction-ownership.json","containsAll":["owner"]},{"path":"documentacion/DECISIONS/ADR-002-transaction-partitioning.md","containsAll":["transacci"]}]},
    {"id":"ENG-003","name":"Cola fuera de línea gobernada","owner":"plataforma","evidence":[{"path":"documentacion/REQUERIMIENTOS/OFFLINE_POLICY.md","containsAll":["offline"]},{"path":"documentacion/FEATURES/stage-28-async-workers.md","containsAll":["dead-letter","retry"]}]},
    {"id":"ENG-004","name":"Promoción ligada al artefacto","owner":"release","evidence":[{"path":"documentacion/OPERATIONS/release-checklist.md","containsAll":["rollback"]},{"path":"documentacion/RELEASE/release-35.0.0-evidence.json","containsAll":["artifact"]}]},
    {"id":"ENG-005","name":"Telemetría privada y no bloqueante","owner":"operación","evidence":[{"path":"functions/src/core/observability/Logger.js","containsAll":["sanit"]}]},
    {"id":"ENG-006","name":"Optimización con presupuesto","owner":"módulo","evidence":[{"path":"documentacion/OPERATIONS/performance-capacity-cost-validation-plan.md","containsAll":["presupuesto","memoria"]}]},
    {"id":"ENG-007","name":"Estrangulamiento verificable de legado","owner":"mantenimiento","evidence":[{"path":"documentacion/ARCHITECTURE/application-structure.md","containsAll":["legacy","impide"]}]},
    {"id":"ENG-008","name":"Incidente como conocimiento","owner":"incidente","evidence":[{"path":"documentacion/OPERATIONS/incident-runbook.md","containsAll":["causa raíz","riesgo residual"]}]}
  ],
  "limits":["no ejecuta el código del proyecto","no evalúa producción ni seguridad integral","la presencia textual requiere revisión humana","gap no significa incumplimiento"]
}
