{
  "schemaVersion":"1.0.0",
  "project":{"repository":"https://github.com/billy-una/posguapiles.git","ref":"303890830433f5019818a1b4fd696b9e33b45392","expectedRemote":"https://github.com/billy-una/posguapiles.git","expectedCommit":"303890830433f5019818a1b4fd696b9e33b45392"},
  "scope":"franja de ingeniería operativa; evaluación estructural desde objetos Git",
  "contracts":[
    {"id":"ENG-001","name":"Estado operativo explícito","owner":"producto","evidence":[{"path":"AGENTS.md","containsAll":["PageStateService","AsyncActionController"]},{"path":"test/ux-operational-contract.test.mjs","containsAll":["PageStateService"]}]},
    {"id":"ENG-002","name":"Autoridad transaccional","owner":"aplicación","evidence":[{"path":"functions/handlers/commit-sale.js","containsAll":["requestId","scope"]},{"path":"functions/test/commit-sale-modular-contract.test.js","containsAll":["commitSale","company-scoped"]}]},
    {"id":"ENG-003","name":"Cola fuera de línea gobernada","owner":"plataforma","evidence":[{"path":"src/public/dataLayer/offline/OfflinePolicy.js","containsAll":["online-only"]},{"path":"test/offline-resilience.test.mjs","containsAll":["dead"]}]},
    {"id":"ENG-004","name":"Promoción ligada al artefacto","owner":"release","evidence":[{"path":"documentacion/OPERATIONS/RELEASE_PROMOTION_RUNBOOK.md","containsAll":["SHA","rollback"]},{"path":"tools/evaluate-go-no-go.mjs","containsAll":["artifact"]}]},
    {"id":"ENG-005","name":"Telemetría privada y no bloqueante","owner":"operación","evidence":[{"path":"AGENTS.md","containsAll":["sanitiz","cola"]},{"path":"test/telemetry-policy.test.mjs","containsAll":["sanitiz"]}]},
    {"id":"ENG-006","name":"Optimización con presupuesto","owner":"módulo","evidence":[{"path":"documentacion/DEVELOPMENT/CONTINUOUS_OPTIMIZATION_LINE.md","containsAll":["medir"]},{"path":"tools/check-performance-budget.mjs","containsAll":["budget"]}]},
    {"id":"ENG-007","name":"Estrangulamiento verificable de legado","owner":"mantenimiento","evidence":[{"path":"AGENTS.md","containsAll":["no-growth","legacy"]},{"path":"functions/test/functions-legacy-isolation-contract.test.js","containsAll":["legacy"]}]},
    {"id":"ENG-008","name":"Incidente como conocimiento","owner":"incidente","evidence":[{"path":"AGENTS.md","containsAll":["causa raíz","riesgo residual"]},{"path":"documentacion/DEVELOPMENT/INCIDENTES_SOLUCIONES_2026-09-20.md","containsAll":["causa raíz"]}]}
  ],
  "limits":["no ejecuta el código del proyecto","no evalúa producción ni seguridad integral","la presencia textual requiere revisión humana","not-assessed no significa incumplimiento"]
}
